,text,cleantext,afinn,newtext,clusters
118,My Administration has also imposed tough sanctions on the communist and socialist dictatorships in Cuba and Venezuela.,my administration has also imposed tough sanctions on the communist and socialist dictatorships in cuba and venezuela.,Negative,my administration have also impose tough sanction on the communist and socialist dictatorship in cuba and venezuela .,3
119,But no regime has oppressed its own citizens more totally or brutally than the cruel dictatorship in North Korea.,but no regime has oppressed its own citizens more totally or brutally than the cruel dictatorship in north korea.,Negative,but no regime have oppress it own citizen more totally or brutally than the cruel dictatorship in north korea .,1
120,North Korea's reckless pursuit of nuclear missiles could very soon threaten our homeland.,north korea's reckless pursuit of nuclear missiles could very soon threaten our homeland.,Negative,north korea 's reckless pursuit of nuclear missile could very soon threaten our homeland .,1
121,We are waging a campaign of maximum pressure to prevent that from happening.,we are waging a campaign of maximum pressure to prevent that from happening.,Negative,we be wag a campaign of maximum pressure to prevent that from happen .,14
122,Past experience has taught us that complacency and concessions only invite aggression and provocation. I will not repeat the mistakes of past administrations that got us into this dangerous position.,past experience has taught american that complacency and concessions only invite aggression and provocation. i will not repeat the mistakes of past administrations that got american into this dangeroamerican position.,Negative,past experience have teach u that complacency and concession only invite aggression and provocation . i will not repeat the mistake of past administration that get u into this dangerous position .,10
123,We need only look at the depraved character of the North Korean regime to understand the nature of the nuclear threat it could pose to America and our allies.,we need only look at the depraved character of the north korean regime to understand the nature of the nuclear threat it could pose to america and our allies.,Negative,we need only look at the depraved character of the north korean regime to understand the nature of the nuclear threat it could pose to america and our ally .,0
124,"Otto Warmbier was a hardworking student at the University of Virginia. On his way to study abroad in Asia, Otto joined a tour to North Korea. At its conclusion, this wonderful young man was arrested and charged with crimes against the state. After a shameful trial, the dictatorship sentenced Otto to 15 years of hard labor, before returning him to America last June — horribly injured and on the verge of death. He passed away just days after his return.","otto warmbier was a hardworking student at the university of virginia. on his way to study abroad in asia, otto joined a tour to north korea. at its conclamericanion, this wonderful young man was arrested and charged with crimes against the state. after a shameful trial, the dictatorship sentenced otto to 15 year of hard labor, before returning him to america last june — horribly injured and on the verge of death. he passed away jamericant days after his return.",Negative,"otto warmbier be a hardworking student at the university of virginia . on his way to study abroad in asia , otto join a tour to north korea . at it conclusion , this wonderful young man be arrest and charge with crime against the state . after a shameful trial , the dictatorship sentence otto to 15 year of hard labor , before return him to america last june — horribly injure and on the verge of death . he pass away just day after his return .",1
125,"Otto's Parents, Fred and Cindy Warmbier, are with us tonight — along with Otto's brother and sister, Austin and Greta. You are powerful witnesses to a menace that threatens our world, and your strength inspires us all. Tonight, we pledge to honor Otto's memory with American resolve.","otto's parents, fred and cindy warmbier, are with american tonight — along with otto's brother and sister, aamericantin and greta. you are powerful witnesses to a menace that threatens our world, and your strength inspires american all. tonight, we pledge to honor otto's memory with american resolve.",Positive,"otto 's parent , fred and cindy warmbier , be with u tonight — along with otto 's brother and sister , austin and greta . you be powerful witness to a menace that threaten our world , and your strength inspire u all . tonight , we pledge to honor otto 's memory with american resolve .",14
126,"Finally, we are joined by one more witness to the ominous nature of this regime. His name is Mr. Ji Seong-ho.","finally, we are joined by one more witness to the ominoamerican nature of this regime. his name is mr. ji seong-ho.",Neutral,"finally , we be join by one more witness to the ominous nature of this regime . his name be mr. ji seong-ho .",8
127,"In 1996, Seong-ho was a starving boy in North Korea. One day, he tried to steal coal from a railroad car to barter for a few scraps of food. In the process, he passed out on the train tracks, exhausted from hunger. He woke up as a train ran over his limbs. He then endured multiple amputations without anything to dull the pain. His brother and sister gave what little food they had to help him recover and ate dirt themselves — permanently stunting their own growth. Later, he was tortured by North Korean authorities after returning from a brief visit to China. His tormentors wanted to know if he had met any Christians. He had — and he resolved to be free.","in 1996, seong-ho was a starving boy in north korea. one day, he tried to steal coal from a railroad car to barter for a few scraps of food. in the process, he passed out on the train tracks, exhaamericanted from hunger. he woke up as a train ran over his limbs. he then endured multiple amputations without anything to dull the pain. his brother and sister gave what little food they had to help him recover and ate dirt themselves — permanently stunting their own growth. later, he was tortured by north korean authorities after returning from a brief visit to china. his tormentors wanted to know if he had met any christians. he had — and he resolved to be free.",Negative,"in 1996 , seong-ho be a starving boy in north korea . one day , he try to steal coal from a railroad car to barter for a few scrap of food . in the process , he pass out on the train track , exhaust from hunger . he wake up a a train ran over his limb . he then endure multiple amputation without anything to dull the pain . his brother and sister give what little food they have to help him recover and eat dirt themselves — permanently stunt their own growth . later , he be torture by north korean authority after return from a brief visit to china . his tormentor want to know if he have meet any christian . he have — and he resolve to be free .",1
128,"Seong-ho traveled thousands of miles on crutches across China and Southeast Asia to freedom. Most of his family followed. His father was caught trying to escape, and was tortured to death.","seong-ho traveled thoamericanands of miles on crutches across china and southeast asia to freedom. most of his family followed. his father was caught trying to escape, and was tortured to death.",Negative,"seong-ho travel thousand of mile on crutch across china and southeast asia to freedom . most of his family follow . his father be catch try to escape , and be torture to death .",8
129,"Today he lives in Seoul, where he rescues other defectors, and broadcasts into North Korea what the regime fears the most — the truth.","today he lives in seoul, where he rescues other defectors, and broadcasts into north korea what the regime fears the most — the truth.",Positive,"today he live in seoul , where he rescue other defector , and broadcast into north korea what the regime fear the most — the truth .",1
130,"Today he has a new leg, but Seong-ho, I understand you still keep those crutches as a reminder of how far you have come. Your great sacrifice is an inspiration to us all.","today he has a new leg, but seong-ho, i understand you still keep those crutches as a reminder of how far you have come. your great sacrifice is an inspiration to american all.",Positive,"today he have a new leg , but seong-ho , i understand you still keep those crutch a a reminder of how far you have come . your great sacrifice be an inspiration to u all .",8
131,Seong-ho's story is a testament to the yearning of every human soul to live in freedom.,seong-ho's story is a testament to the yearning of every human soul to live in freedom.,Positive,seong-ho 's story be a testament to the yearning of every human soul to live in freedom .,8
132,"It was that same yearning for freedom that nearly 250 years ago gave birth to a special place called America. It was a small cluster of colonies caught between a great ocean and a vast wilderness. But it was home to an incredible people with a revolutionary idea: that they could rule themselves. That they could chart their own destiny. And that, together, they could light up the world.","it was that same yearning for freedom that nearly 250 year ago gave birth to a special place called america. it was a small clamericanter of colonies caught between a great ocean and a vast wilderness. but it was home to an incredible people with a revolutionary idea: that they could rule themselves. that they could chart their own destiny. and that, together, they could light up the world.",Positive,"it be that same yearning for freedom that nearly 250 year ago give birth to a special place call america . it be a small cluster of colony catch between a great ocean and a vast wilderness . but it be home to an incredible people with a revolutionary idea : that they could rule themselves . that they could chart their own destiny . and that , together , they could light up the world .",11
133,"That is what our country has always been about. That is what Americans have always stood for, always strived for, and always done.","that is what our country has always been about. that is what american have always stood for, always strived for, and always done.",Neutral,"that be what our country have always be about . that be what american have always stand for , always strive for , and always do .",3
134,Atop the dome of this Capitol stands the Statue of Freedom. She stands tall and dignified among the monuments to our ancestors who fought and lived and died to protect her.,atop the dome of this capitol stands the statue of freedom. she stands tall and dignified among the monuments to our ancestors who fought and lived and died to protect her.,Neutral,atop the dome of this capitol stand the statue of freedom . she stand tall and dignify among the monument to our ancestor who fight and live and die to protect her .,15
135,Monuments to Washington and Jefferson — to Lincoln and King.,monuments to washington and jefferson — to lincoln and king.,Neutral,monument to washington and jefferson — to lincoln and king .,14
136,"Memorials to the heroes of Yorktown and Saratoga — to young Americans who shed their blood on the shores of Normandy, and the fields beyond. And others, who went down in the waters of the Pacific and the skies over Asia.","memorials to the heroes of yorktown and saratoga — to young american who shed their blood on the shores of normandy, and the fields beyond. and others, who went down in the waters of the pacific and the skies over asia.",Positive,"memorial to the hero of yorktown and saratoga — to young american who shed their blood on the shore of normandy , and the field beyond . and others , who go down in the water of the pacific and the sky over asia .",6
137,And freedom stands tall over one more monument: this one. This Capitol. This living monument to the American people.,and freedom stands tall over one more monument: this one. this capitol. this living monument to the american people.,Positive,and freedom stand tall over one more monument : this one . this capitol . this living monument to the american people .,15
138,"A people whose heroes live not only in the past, but all around us — defending hope, pride, and the American way.","a people whose heroes live not only in the past, but all around american — defending hope, pride, and the american way.",Positive,"a people whose hero live not only in the past , but all around u — defend hope , pride , and the american way .",6
139,"They work in every trade. They sacrifice to raise a family. They care for our children at home. They defend our flag abroad. They are strong moms and brave kids. They are firefighters, police officers, border agents, medics, and Marines.","they work in every trade. they sacrifice to raise a family. they care for our children at home. they defend our flag abroad. they are strong moms and brave kids. they are firefighters, police officers, border agents, medics, and marines.",Positive,"they work in every trade . they sacrifice to raise a family . they care for our child at home . they defend our flag abroad . they be strong mom and brave kid . they be firefighter , police officer , border agent , medic , and marine .",12
140,"But above all else, they are Americans. And this Capitol, this city, and this nation, belong to them.","but above all else, they are american. and this capitol, this city, and this nation, belong to them.",Neutral,"but above all else , they be american . and this capitol , this city , and this nation , belong to them .",14
141,"Our task is to respect them, to listen to them, to serve them, to protect them, and to always be worthy of them.","our task is to respect them, to listen to them, to serve them, to protect them, and to always be worthy of them.",Positive,"our task be to respect them , to listen to them , to serve them , to protect them , and to always be worthy of them .",14
142,Americans fill the world with art and music. They push the bounds of science and discovery. And they forever remind us of what we should never forget: The people dreamed this country. The people built this country. And it is the people who are making America great again.,american fill the world with art and mamericanic. they pamericanh the bounds of science and discovery. and they forever remind american of what we should never forget: the people dreamed this country. the people built this country. and it is the people who are making america great again.,Positive,american fill the world with art and music . they push the bound of science and discovery . and they forever remind u of what we should never forget : the people dream this country . the people build this country . and it be the people who be make america great again .,2
143,"As long as we are proud of who we are, and what we are fighting for, there is nothing we cannot achieve.","as long as we are proud of who we are, and what we are fighting for, there is nothing we cannot achieve.",Positive,"as long a we be proud of who we be , and what we be fight for , there be nothing we can not achieve .",3
144,"As long as we have confidence in our values, faith in our citizens, and trust in our God, we will not fail.","as long as we have confidence in our values, faith in our citizens, and tramericant in our god, we will not fail.",Positive,"as long a we have confidence in our value , faith in our citizen , and trust in our god , we will not fail .",3
145,Our families will thrive.,our families will thrive.,Neutral,our family will thrive .,14
146,Our people will prosper.,our people will prosper.,Neutral,our people will prosper .,2
147,And our nation will forever be safe and strong and proud and mighty and free.,and our nation will forever be safe and strong and proud and mighty and free.,Positive,and our nation will forever be safe and strong and proud and mighty and free .,5
148,"Thank you, and God bless America.","thank you, and god bless america.",Positive,"thank you , and god bless america .",5
